,Date,Author,Title,Publication Title,PMID,DOI,PMCID,Link Attachments
328,2022 Jan 30,"Kilintzis V, Beredimas N, Kaimakamis E, Stefanopoulos L, Chatzis E, Jahaj E, Bitzani M, Kotanidou A, Katsaggelos AK, Maglaveras N",CoCross: An ICT Platform Enabling Monitoring Recording and Fusion of Clinical Information Chest Sounds and Imaging of COVID-19 ICU Patients,Healthcare,35206889,10.3390/healthcare10020276,PMC8871733,https://www.ncbi.nlm.nih.gov/pmc/articles/PMC8871733
329,2022 Jan 27,"Chhetri TR, Kurteva A, Adigun JG, Fensel A",Knowledge Graph Based Hard Drive Failure Prediction,"Sensors (Basel, Switzerland)",35161730,10.3390/s22030985,PMC8839111,https://www.ncbi.nlm.nih.gov/pmc/articles/PMC8839111
330,2022 Jan 26,"de Mello BH, Rigo SJ, da Costa CA, da Rosa Righi R, Donida B, Bez MR, Schunke LC",Semantic interoperability in health records standards: a systematic literature review,Health and Technology,35103230,10.1007/s12553-022-00639-w,PMC8791650,https://www.ncbi.nlm.nih.gov/pmc/articles/PMC8791650
331,2022 Jan 14,"Garcia-Giralt N, Roca-Ayats N, Abril JF, Martinez-Gil N, Ovejero D, Castañeda S, Nogues X, Grinberg D, Balcells S, Rabionet R",Gene Network of Susceptibility to Atypical Femoral Fractures Related to Bisphosphonate Treatment,Genes,35052486,10.3390/genes13010146,PMC8774942,https://www.ncbi.nlm.nih.gov/pmc/articles/PMC8774942
332,2022 Jan 14,"Schindler D, Bensmann F, Dietze S, Krüger F",The role of software in science: a knowledge graph-based analysis of software mentions in PubMed Central,PeerJ Computer Science,35111920,10.7717/peerj-cs.835,PMC8771769,https://www.ncbi.nlm.nih.gov/pmc/articles/PMC8771769
333,2021 Dec 20,"Jalali A, Johannesson P, Perjons E, Askfors Y, Rezaei Kalladj A, Shemeikka T, Vég A",dfgcompare: a library to support process variant analysis through Markov models,BMC Medical Informatics and Decision Making,34930223,10.1186/s12911-021-01715-3,PMC8686257,https://www.ncbi.nlm.nih.gov/pmc/articles/PMC8686257
334,2021 Dec 18,"Wandy J, Daly R",GraphOmics: an interactive platform to explore and integrate multi-omics data,BMC Bioinformatics,34922446,10.1186/s12859-021-04500-1,PMC8684259,https://www.ncbi.nlm.nih.gov/pmc/articles/PMC8684259
335,2021 Dec 14,"Al-Taie Z, Hannink M, Mitchem J, Papageorgiou C, Shyu CR",Drug Repositioning and Subgroup Discovery for Precision Medicine Implementation in Triple Negative Breast Cancer,Cancers,34944904,10.3390/cancers13246278,PMC8699385,https://www.ncbi.nlm.nih.gov/pmc/articles/PMC8699385
336,2021 Dec 6,"Zhu Y, Talha M",Research on the Path of Network Opinion Expression in AI Environment for College Students,Computational and Mathematical Methods in Medicine,34925540,10.1155/2021/4360792,PMC8674046,https://www.ncbi.nlm.nih.gov/pmc/articles/PMC8674046
337,2021 Nov 30,"Li B, Peng X, Xiang Q, Wang H, Xie T, Sun J, Liu X",Enjoy your observability: an industrial survey of microservice tracing and analysis,Empirical Software Engineering,34867075,10.1007/s10664-021-10063-9,PMC8629732,https://www.ncbi.nlm.nih.gov/pmc/articles/PMC8629732
338,2021 Nov 29,"Williams CJ, Richardson DC, Richardson JS",The importance of residue‐level filtering and the Top2018 best‐parts dataset of high‐quality protein residues,Protein Science : A Publication of the Protein Society,34779043,10.1002/pro.4239,PMC8740842,https://www.ncbi.nlm.nih.gov/pmc/articles/PMC8740842
339,2021 Nov 25,"Sadegh S, Skelton J, Anastasi E, Bernett J, Blumenthal DB, Galindez G, Salgado-Albarrán M, Lazareva O, Flanagan K, Cockell S, Nogales C, Casas AI, Schmidt HH, Baumbach J, Wipat A, Kacprowski T",Network medicine for disease module identification and drug repurposing with the NeDRex platform,Nature Communications,34824199,10.1038/s41467-021-27138-2,PMC8617287,https://www.ncbi.nlm.nih.gov/pmc/articles/PMC8617287
340,2021 Nov 24,"Dafniet B, Cerisier N, Boezio B, Clary A, Ducrot P, Dorval T, Gohier A, Brown D, Audouze K, Taboureau O",Development of a chemogenomics library for phenotypic screening,Journal of Cheminformatics,34819133,10.1186/s13321-021-00569-1,PMC8611952,https://www.ncbi.nlm.nih.gov/pmc/articles/PMC8611952
341,2021 Nov 24,"Raffn J, Christensen AA, de Witt M, Lewis C, Büchner-Marais C",Introducing a flat ontology into landscape research: a case study of water governance experiments in South Africa,Landscape Ecology,34840425,10.1007/s10980-021-01374-9,PMC8611254,https://www.ncbi.nlm.nih.gov/pmc/articles/PMC8611254
342,2021 Nov 15,"Zhang S, Bai G, Li H, Liu P, Zhang M, Li S",Multi-Source Knowledge Reasoning for Data-Driven IoT Security,"Sensors (Basel, Switzerland)",34833653,10.3390/s21227579,PMC8623156,https://www.ncbi.nlm.nih.gov/pmc/articles/PMC8623156
343,2021 Nov 12,"Zhou H, Zhang M, Pang L, Li JH",Abnormal Detection of Cash-Out Groups in IoT Based Payment,"Sensors (Basel, Switzerland)",34833582,10.3390/s21227507,PMC8623590,https://www.ncbi.nlm.nih.gov/pmc/articles/PMC8623590
344,2021 Nov 11,"del Toro N, Shrivastava A, Ragueneau E, Meldal B, Combe C, Barrera E, Perfetto L, How K, Ratan P, Shirodkar G, Lu O, Mészáros B, Watkins X, Pundir S, Licata L, Iannuccelli M, Pellegrini M, Martin MJ, Panni S, Duesbury M, Vallet SD, Rappsilber J, Ricard-Blum S, Cesareni G, Salwinski L, Orchard S, Porras P, Panneerselvam K, Hermjakob H",The IntAct database: efficient access to fine-grained molecular interaction data,Nucleic Acids Research,34761267,10.1093/nar/gkab1006,PMC8728211,https://www.ncbi.nlm.nih.gov/pmc/articles/PMC8728211
345,2021 Nov 10,PDBe-KB consortium VaradiMihalyMAnyangoStephenSArmstrongDavidDBerrisfordJohnJChoudharyPreetiPDeshpandeMandarMNadzirinNurulNNairSreenath SSSPravdaLukasLTanweerAhsanAAl-LazikaniBissanBAndreiniClaudiaCBartonGeoffrey JGJBednarDavidDBerkaKarelKBlundellTomTBrockKelly PKPCarazoJose MariaJMDamborskyJiriJDavidAlessiaADeySucharitaSDunbrackRolandRRecioJuan FernandezJFFraternaliFrancaFGibsonTobyTHelmer-CitterichManuelaMHokszaDavidDHopfThomasTJakubecDavidDKannanNatarajanNKrivakRadoslavRKumarManjeetMLevyEmmanuel DEDLondonNirNMaciasJose RamonJRSrivatsanMadhusudhan MMMMarksDebora SDSMartensLennartLMcGowanStuart ASAMcGreigJake EJEModiVivekVParraR GonzaloRGPepeGerardoGPiovesanDamianoDPriluskyJaimeJPutignanoValeriaVRaduskyLeandro GLGRamasamyPathmanabanPRauschAtilio OAOReuterNathalieNRodriguezLuis ALARollinsNathan JNJRosatoAntonioARubachPawełPSerranoLuisLSinghGulzarGSkodaPetrPSorzanoCarlos Oscar SCOStouracJanJSulkowskaJoanna IJISvobodovaRadkaRTichshenkoNataliaNTosattoSilvio C ESCVrankenWimWWassMark NMNXueDandanDZaidmanDanielDThorntonJanetJSternbergMichaelMOrengoChristineCVelankarSameerS,PDBe-KB: collaboratively defining the biological context of structural data,Nucleic Acids Research,34755867,10.1093/nar/gkab988,PMC8728252,https://www.ncbi.nlm.nih.gov/pmc/articles/PMC8728252
346,2021 Nov 9,"Mehta N, Shukla S",Pandemic Analytics: How Countries are Leveraging Big Data Analytics and Artificial Intelligence to Fight COVID-19?,Sn Computer Science,34778841,10.1007/s42979-021-00923-y,PMC8577168,https://www.ncbi.nlm.nih.gov/pmc/articles/PMC8577168
347,2021 Nov 8,"Courtot M, Gupta D, Liyanage I, Xu F, Burdett T",BioSamples database: FAIRer samples metadata to accelerate research data management,Nucleic Acids Research,34747489,10.1093/nar/gkab1046,PMC8728232,https://www.ncbi.nlm.nih.gov/pmc/articles/PMC8728232
348,2021 Nov 8,"Acón M, Geiß C, Torres-Calvo J, Bravo-Estupiñan D, Oviedo G, Arias-Arias JL, Rojas-Matey LA, Edwin B, Vásquez-Vargas G, Oses-Vargas Y, Guevara-Coto J, Segura-Castillo A, Siles-Canales F, Quirós-Barrantes S, Régnier-Vigouroux A, Mendes P, Mora-Rodríguez R",MYC dosage compensation is mediated by miRNA-transcription factor interactions in aneuploid cancer,iScience,34877484,10.1016/j.isci.2021.103407,PMC8627999,https://www.ncbi.nlm.nih.gov/pmc/articles/PMC8627999
349,2021 Nov 4,"Mao Z, Zou Q, Yao H, Wu J","The application framework of big data technology in the COVID-19 epidemic emergency management in local government—a case study of Hainan Province, China",BMC Public Health,34736445,10.1186/s12889-021-12065-0,PMC8567122,https://www.ncbi.nlm.nih.gov/pmc/articles/PMC8567122
350,2021 Nov 3,"Liu Y, Gu Z, Cao H, Kaphle P, Lyu J, Zhang Y, Hu W, Chung SS, Dickerson KE, Xu J",Convergence of oncogenic cooperation at single-cell and single-gene levels drives leukemic transformation,Nature Communications,34732703,10.1038/s41467-021-26582-4,PMC8566485,https://www.ncbi.nlm.nih.gov/pmc/articles/PMC8566485
351,2021 Oct 27,"Alves VM, Korn D, Pervitsky V, Thieme A, Capuzzi S, Baker N, Chirkova R, Ekins S, Muratov EN, Hickey A, Tropsha A",Knowledge-based approaches to drug discovery for rare diseases,Drug discovery today,34718207,10.1016/j.drudis.2021.10.014,PMC9124594,https://www.ncbi.nlm.nih.gov/pmc/articles/PMC9124594
352,2021 Oct 26,"Sharma S, Arya A, Cruz R, Cleaves II HJ",Automated Exploration of Prebiotic Chemical Reaction Space: Progress and Perspectives,Life,34833016,10.3390/life11111140,PMC8624352,https://www.ncbi.nlm.nih.gov/pmc/articles/PMC8624352
353,2021 Oct 23,"Bundhoo E, Ghoorah AW, Jaufeerally-Fakim Y",TAGOPSIN: collating taxa-specific gene and protein functional and structural information,BMC Bioinformatics,34688246,10.1186/s12859-021-04429-5,PMC8541804,https://www.ncbi.nlm.nih.gov/pmc/articles/PMC8541804
354,2021 Oct 14,"Siramshetty VB, Grishagin I, Nguyễn ÐT, Peryea T, Skovpen Y, Stroganov O, Katzel D, Sheils T, Jadhav A, Mathé EA, Southall NT",NCATS Inxight Drugs: a comprehensive and curated portal for translational research,Nucleic Acids Research,34648031,10.1093/nar/gkab918,PMC8728186,https://www.ncbi.nlm.nih.gov/pmc/articles/PMC8728186
355,2021 Oct 12,"Jiang Y, Gao X, Su W, Li J",Systematic Knowledge Management of Construction Safety Standards Based on Knowledge Graphs: A Case Study in China,International Journal of Environmental Research and Public Health,34682437,10.3390/ijerph182010692,PMC8536078,https://www.ncbi.nlm.nih.gov/pmc/articles/PMC8536078
356,2021 Oct 6,"Chen C, Ross KE, Gavali S, Cowart JE, Wu CH",COVID-19 Knowledge Graph from semantic integration of biomedical literature and databases,Bioinformatics,34613368,10.1093/bioinformatics/btab694,PMC8513397,https://www.ncbi.nlm.nih.gov/pmc/articles/PMC8513397
357,2021 Sep 30,"García S. A, Casamayor JC",On how to generalize species-specific conceptual schemes to generate a species-independent Conceptual Schema of the Genome,BMC Bioinformatics,34592923,10.1186/s12859-021-04237-x,PMC8482561,https://www.ncbi.nlm.nih.gov/pmc/articles/PMC8482561
358,2021 Sep 29,"Ireland SM, Martin AC",GraphQL for the delivery of bioinformatics web APIs and application to ZincBind,Bioinformatics Advances,35585947,10.1093/bioadv/vbab023,PMC9108989,https://www.ncbi.nlm.nih.gov/pmc/articles/PMC9108989
359,2021 Sep 24,"Dimitrova M, Senderov VE, Georgiev T, Zhelezov G, Penev L",Infrastructure and Population of the OpenBiodiv Biodiversity Knowledge Graph,Biodiversity Data Journal,34690512,10.3897/BDJ.9.e67671,PMC8486731,https://www.ncbi.nlm.nih.gov/pmc/articles/PMC8486731
360,2021 Sep 24,"Varma S, Shivam S, Biswas S, Saha P, Jalan K",Graph NLU enabled question answering system,Heliyon,34622048,10.1016/j.heliyon.2021.e08035,PMC8481981,https://www.ncbi.nlm.nih.gov/pmc/articles/PMC8481981
361,2021 Sep 21,"Wu CH, Tsang YP, Lee CK, Ching WK",A Blockchain-IoT Platform for the Smart Pallet Pooling Management,"Sensors (Basel, Switzerland)",34577516,10.3390/s21186310,PMC8469887,https://www.ncbi.nlm.nih.gov/pmc/articles/PMC8469887
362,2021 Sep 17,"Chew LJ, Haw SC, Subramaniam S",A hybrid recommender system based on data enrichment on the ontology modelling,F1000Research,34868563,10.12688/f1000research.73060.1,PMC8609391,https://www.ncbi.nlm.nih.gov/pmc/articles/PMC8609391
363,2021 Sep 17,"Stavropoulos TG, Meditskos G, Lazarou I, Mpaltadoros L, Papagiannopoulos S, Tsolaki M, Kompatsiaris I",Detection of Health-Related Events and Behaviours from Wearable Sensor Lifestyle Data Using Symbolic Intelligence: A Proof-of-Concept Application in the Care of Multiple Sclerosis,"Sensors (Basel, Switzerland)",34577437,10.3390/s21186230,PMC8470200,https://www.ncbi.nlm.nih.gov/pmc/articles/PMC8470200
364,2021 Sep 16,"Bazaga A, Gunwant N, Micklem G",Translating synthetic natural language to database queries with a polyglot deep learning framework,Scientific Reports,34531510,10.1038/s41598-021-98019-3,PMC8445976,https://www.ncbi.nlm.nih.gov/pmc/articles/PMC8445976
365,2021 Sep 1,"Huang X, Zhang J, Xu Z, Ou L, Tong J",A knowledge graph based question answering method for medical domain,PeerJ Computer Science,34604514,10.7717/peerj-cs.667,PMC8444078,https://www.ncbi.nlm.nih.gov/pmc/articles/PMC8444078
366,2021 Aug 24,"Yang B, Yang M",Research on enterprise knowledge service based on semantic reasoning and data fusion,Neural Computing & Applications,34456516,10.1007/s00521-021-06382-z,PMC8384230,https://www.ncbi.nlm.nih.gov/pmc/articles/PMC8384230
367,2021 Aug 20,"Baltoumas FA, Zafeiropoulou S, Karatzas E, Koutrouli M, Thanati F, Voutsadaki K, Gkonta M, Hotova J, Kasionis I, Hatzis P, Pavlopoulos GA",Biomolecule and Bioentity Interaction Databases in Systems Biology: A Comprehensive Review,Biomolecules,34439912,10.3390/biom11081245,PMC8391349,https://www.ncbi.nlm.nih.gov/pmc/articles/PMC8391349
368,2021 Aug 19,"Khashan E, Eldesouky A, Elghamrawy S",An adaptive spark-based framework for querying large-scale NoSQL and relational databases,PLoS ONE,34411131,10.1371/journal.pone.0255562,PMC8376024,https://www.ncbi.nlm.nih.gov/pmc/articles/PMC8376024
369,2021 Aug 12,"Rubio-Sandoval JI, Martinez-Rodriguez JL, Lopez-Arevalo I, Rios-Alvarado AB, Rodriguez-Rodriguez AJ, Vargas-Requena DT",An Indoor Navigation Methodology for Mobile Devices by Integrating Augmented Reality and Semantic Web,"Sensors (Basel, Switzerland)",34450877,10.3390/s21165435,PMC8401022,https://www.ncbi.nlm.nih.gov/pmc/articles/PMC8401022
370,2021 Aug 5,"Budde K, Smith J, Wilsdorf P, Haack F, Uhrmacher AM",Relating simulation studies by provenance—Developing a family of Wnt signaling models,PLoS Computational Biology,34351901,10.1371/journal.pcbi.1009227,PMC8407594,https://www.ncbi.nlm.nih.gov/pmc/articles/PMC8407594
371,2021 Aug 3,"Pawlicka A, Pawlicki M, Kozik R, Choraś RS",A Systematic Review of Recommender Systems and Their Applications in Cybersecurity,"Sensors (Basel, Switzerland)",34372489,10.3390/s21155248,PMC8347790,https://www.ncbi.nlm.nih.gov/pmc/articles/PMC8347790
372,2021 Aug 3,"Serrano Nájera G, Narganes Carlón D, Crowther DJ","TrendyGenes, a computational pipeline for the detection of literature trends in academia and drug discovery",Scientific Reports,34344904,10.1038/s41598-021-94897-9,PMC8333311,https://www.ncbi.nlm.nih.gov/pmc/articles/PMC8333311
373,2021 Jul 29,"Yang X, Wu C, Nenadic G, Wang W, Lu K",Mining a stroke knowledge graph from literature,BMC Bioinformatics,34325669,10.1186/s12859-021-04292-4,PMC8319697,https://www.ncbi.nlm.nih.gov/pmc/articles/PMC8319697
374,2021 Jul 22,"Fang A, Lou P, Hu J, Zhao W, Feng M, Ren H, Chen X",Head and Tail Entity Fusion Model in Medical Knowledge Graph Construction: Case Study for Pituitary Adenoma,JMIR Medical Informatics,34057414,10.2196/28218,PMC8367125,https://www.ncbi.nlm.nih.gov/pmc/articles/PMC8367125
375,2021 Jul 20,"Fecho K, Bizon C, Miller F, Schurman S, Schmitt C, Xue W, Morton K, Wang P, Tropsha A",A Biomedical Knowledge Graph System to Propose Mechanistic Hypotheses for Real-World Environmental Health Observations: Cohort Study and Informatics Application,JMIR Medical Informatics,34283031,10.2196/26714,PMC8335603,https://www.ncbi.nlm.nih.gov/pmc/articles/PMC8335603
376,2021 Jul 19,"Wang H, Robinson JL, Kocabas P, Gustafsson J, Anton M, Cholley PE, Huang S, Gobom J, Svensson T, Uhlen M, Zetterberg H, Nielsen J",Genome-scale metabolic network reconstruction of model animals as a platform for translational research,Proceedings of the National Academy of Sciences of the United States of America,34282017,10.1073/pnas.2102344118,PMC8325244,https://www.ncbi.nlm.nih.gov/pmc/articles/PMC8325244
377,2021 Jul 12,,News,Datenbank-Spektrum,34276274,10.1007/s13222-021-00383-x,PMC8274660,https://www.ncbi.nlm.nih.gov/pmc/articles/PMC8274660
378,2021 Jul 2,"Muratov EN, Amaro R, Andrade CH, Brown N, Ekins S, Fourches D, Isayev O, Kozakov D, Medina-Franco JL, Merz KM, Oprea TI, Poroikov V, Schneider G, Todd MH, Varnek A, Winkler DA, Zakharov AV, Cherkasov A, Tropsha A",A critical overview of computational approaches employed for COVID-19 drug discovery,Chemical Society Reviews,34212944,10.1039/d0cs01065k,PMC8371861,https://www.ncbi.nlm.nih.gov/pmc/articles/PMC8371861
379,2021 Jun 29,"Barbagallo C, Di Maria A, Alecci A, Barbagallo D, Alaimo S, Colarossi L, Ferro A, Di Pietro C, Purrello M, Pulvirenti A, Ragusa M",VECTOR: An Integrated Correlation Network Database for the Identification of CeRNA Axes in Uveal Melanoma,Genes,34210067,10.3390/genes12071004,PMC8305227,https://www.ncbi.nlm.nih.gov/pmc/articles/PMC8305227
380,2021 Jun 24,"Osanlouy M, Bandrowski A, de Bono B, Brooks D, Cassarà AM, Christie R, Ebrahimi N, Gillespie T, Grethe JS, Guercio LA, Heal M, Lin M, Kuster N, Martone ME, Neufeld E, Nickerson DP, Soltani EG, Tappan S, Wagenaar JB, Zhuang K, Hunter PJ",The SPARC DRC: Building a Resource for the Autonomic Nervous System Community,Frontiers in Physiology,34248680,10.3389/fphys.2021.693735,PMC8265045,https://www.ncbi.nlm.nih.gov/pmc/articles/PMC8265045
381,2021 Jun 22,"Ghazal R, Malik AK, Raza B, Qadeer N, Qamar N, Bhatia S",Agent-Based Semantic Role Mining for Intelligent Access Control in Multi-Domain Collaborative Applications of Smart Cities,"Sensors (Basel, Switzerland)",34206164,10.3390/s21134253,PMC8272182,https://www.ncbi.nlm.nih.gov/pmc/articles/PMC8272182
382,2021 Jun 21,"Wagner J, Kancherla J, Braccia D, Matsumara J, Felix V, Crabtree J, Mahurkar A, Corrada Bravo H",Interactive exploratory data analysis of Integrative Human Microbiome Project data using Metaviz,F1000Research,32742640,10.12688/f1000research.24345.1,PMC7366035,https://www.ncbi.nlm.nih.gov/pmc/articles/PMC7366035
383,2021 Jun 15,"Flynn NR, Ward MD, Schleiff MA, Laurin CM, Farmer R, Conway SJ, Boysen G, Swamidass SJ, Miller GP",Bioactivation of Isoxazole-Containing Bromodomain and Extra-Terminal Domain (BET) Inhibitors,Metabolites,34203690,10.3390/metabo11060390,PMC8232216,https://www.ncbi.nlm.nih.gov/pmc/articles/PMC8232216
384,2021 Jun 7,"Salvi D, Poffley E, Tarassenko L, Orchard E",App-Based Versus Standard Six-Minute Walk Test in Pulmonary Hypertension: Mixed Methods Study,JMIR mHealth and uHealth,34096876,10.2196/22748,PMC8218218,https://www.ncbi.nlm.nih.gov/pmc/articles/PMC8218218
385,2021 May 28,"Silva de Oliveira M, Thyeska Castro Alves J, Henrique Caracciolo Gomes de Sá P, Veras AA",PAN2HGENE–tool for comparative analysis and identifying new gene products,PLoS ONE,34048479,10.1371/journal.pone.0252414,PMC8162609,https://www.ncbi.nlm.nih.gov/pmc/articles/PMC8162609
386,2021 May 27,"Morgiève M, Mesdjian P, Las Vergnas O, Bury P, Demassiet V, Roelandt JL, Sebbane D",Social Representations of e-Mental Health Among the Actors of the Health Care System: Free-Association Study,JMIR Mental Health,34042591,10.2196/25708,PMC8193480,https://www.ncbi.nlm.nih.gov/pmc/articles/PMC8193480
387,2021 May 26,"McCoy K, Gudapati S, He L, Horlander E, Kartchner D, Kulkarni S, Mehra N, Prakash J, Thenot H, Vanga SV, Wagner A, White B, Mitchell CS",Biomedical Text Link Prediction for Drug Discovery: A Case Study with COVID-19,Pharmaceutics,34073456,10.3390/pharmaceutics13060794,PMC8230210,https://www.ncbi.nlm.nih.gov/pmc/articles/PMC8230210
388,2021 May 25,"Kanakaris N, Giarelis N, Siachos I, Karacapilidis N",Shall I Work with Them? A Knowledge Graph-Based Approach for Predicting Future Research Collaborations,Entropy,34070422,10.3390/e23060664,PMC8226892,https://www.ncbi.nlm.nih.gov/pmc/articles/PMC8226892
389,2021 May 25,"Huckstep H, Fearnley LG, Davis MJ",Measuring pathway database coverage of the phosphoproteome,PeerJ,34113485,10.7717/peerj.11298,PMC8162239,https://www.ncbi.nlm.nih.gov/pmc/articles/PMC8162239
390,2021 May 21,Kerrache S,LinkPred: a high performance library for link prediction in complex networks,PeerJ Computer Science,34084927,10.7717/peerj-cs.521,PMC8157017,https://www.ncbi.nlm.nih.gov/pmc/articles/PMC8157017
391,2021 Apr 22,"Jung H, Phoa FK",A Mixture Model of Truncated Zeta Distributions with Applications to Scientific Collaboration Networks ,Entropy,33922279,10.3390/e23050502,PMC8146345,https://www.ncbi.nlm.nih.gov/pmc/articles/PMC8146345
392,2021 Apr 17,"Fadlelmola FM, Ghedira K, Hamdi Y, Hanachi M, Radouani F, Allali I, Kiran A, Zass L, Alsayed N, Fassatoui M, Samtal C, Ahmed S, Da Rocha J, Chaqsare S, Sallam RM, Chaouch M, Farahat MA, Ssekagiri A, Parker Z, Adil M, Turkson M, Benchaalia A, Benkahla A, Panji S, Kassim S, Souiai O, Mulder N",H3ABioNet genomic medicine and microbiome data portals hackathon proceedings,Database: The Journal of Biological Databases and Curation,33864455,10.1093/database/baab016,PMC8052916,https://www.ncbi.nlm.nih.gov/pmc/articles/PMC8052916
393,2021 Apr 14,"Chatterjee A, Nardi C, Oberije C, Lambin P",Knowledge Graphs for COVID-19: An Exploratory Review of the Current Landscape,Journal of Personalized Medicine,33919882,10.3390/jpm11040300,PMC8070774,https://www.ncbi.nlm.nih.gov/pmc/articles/PMC8070774
394,2021 Apr 9,"Coimbra ME, Francisco AP, Veiga L",An analysis of the graph processing landscape,Journal of Big Data,33850687,10.1186/s40537-021-00443-9,PMC8033100,https://www.ncbi.nlm.nih.gov/pmc/articles/PMC8033100
395,2021 Apr 8,"Mazein A, Rougny A, Karr JR, Saez-Rodriguez J, Ostaszewski M, Schneider R",Reusability and composability in process description maps: RAS–RAF–MEK–ERK signalling,Briefings in Bioinformatics,33834185,10.1093/bib/bbab103,PMC8425390,https://www.ncbi.nlm.nih.gov/pmc/articles/PMC8425390
396,2021 Apr 5,"Hassani‐Pak K, Singh A, Brandizi M, Hearnshaw J, Parsons JD, Amberkar S, Phillips AL, Doonan JH, Rawlings C",KnetMiner: a comprehensive approach for supporting evidence‐based gene discovery and complex trait analysis across species,Plant Biotechnology Journal,33750020,10.1111/pbi.13583,PMC8384599,https://www.ncbi.nlm.nih.gov/pmc/articles/PMC8384599
397,2021 Apr 3,"Villalba-Diez J, Losada JC, Benito RM, Schmidt D",Industry 4.0 Quantum Strategic Organizational Design Configurations. The Case of 3 Qubits: Two Report to One,Entropy,33916662,10.3390/e23040426,PMC8065959,https://www.ncbi.nlm.nih.gov/pmc/articles/PMC8065959
398,2021 Mar 24,"Rougny A, Touré V, Albanese J, Waltemath D, Shirshov D, Sorokin A, Bader GD, Blinov ML, Mazein A",SBGN Bricks Ontology as a tool to describe recurring concepts in molecular networks,Briefings in Bioinformatics,33758926,10.1093/bib/bbab049,PMC8425392,https://www.ncbi.nlm.nih.gov/pmc/articles/PMC8425392
399,2021 Mar 24,"Grigoriu A, Zaveri A, Weiss G, Dumontier M",SIENA: Semi-automatic semantic enhancement of datasets using concept recognition,Journal of Biomedical Semantics,33761996,10.1186/s13326-021-00239-z,PMC7992819,https://www.ncbi.nlm.nih.gov/pmc/articles/PMC7992819
400,2021 Mar 23,"Hannestad LM, Dančík V, Godden M, Suen IW, Huellas-Bruskiewicz KC, Good BM, Mungall CJ, Bruskiewich RM",Knowledge Beacons: Web services for data harvesting of distributed biomedical knowledge,PLoS ONE,33755673,10.1371/journal.pone.0231916,PMC7987184,https://www.ncbi.nlm.nih.gov/pmc/articles/PMC7987184
401,2021 Mar 20,"Villalba-Diez J, Losada JC, Benito RM, González-Marcos A",Industry 4.0 Quantum Strategic Organizational Design Configurations. The Case of 3 Qubits: One Reports to Two,Entropy,33804746,10.3390/e23030374,PMC8003965,https://www.ncbi.nlm.nih.gov/pmc/articles/PMC8003965
402,2021 Mar 1,"Yokoyama TT, Okada M, Taniguchi T",Panacea: Visual exploration system for analyzing trends in annual recruitment using time-varying graphs,PLoS ONE,33647012,10.1371/journal.pone.0247587,PMC7920367,https://www.ncbi.nlm.nih.gov/pmc/articles/PMC7920367
403,2021 Feb 27,"Huang Z, Hu Q, Liao M, Miao C, Wang C, Liu G",Knowledge Graphs of Kawasaki Disease,Health Information Science and Systems,33680447,10.1007/s13755-020-00130-8,PMC7910781,https://www.ncbi.nlm.nih.gov/pmc/articles/PMC7910781
404,2021 Feb 24,"Zhang B, Tang C, Yao Y, Chen X, Zhou C, Wei Z, Xing F, Chen L, Cai X, Zhang Z, Sun S, Liu Q",The tumor therapy landscape of synthetic lethality,Nature Communications,33627666,10.1038/s41467-021-21544-2,PMC7904840,https://www.ncbi.nlm.nih.gov/pmc/articles/PMC7904840
405,2021 Feb 23,"Yamada I, Campbell MP, Edwards N, Castro LJ, Lisacek F, Mariethoz J, Ono T, Ranzinger R, Shinmachi D, Aoki-Kinoshita KF",The glycoconjugate ontology (GlycoCoO) for standardizing the annotation of glycoconjugate data and its application,Glycobiology,33677548,10.1093/glycob/cwab013,PMC8351504,https://www.ncbi.nlm.nih.gov/pmc/articles/PMC8351504
406,2021 Feb 22,"Lazar AA, Liu T, Turkcan MK, Zhou Y",Accelerating with FlyBrainLab the discovery of the functional logic of the Drosophila brain in the connectomic and synaptomic era,eLife,33616035,10.7554/eLife.62362,PMC8016480,https://www.ncbi.nlm.nih.gov/pmc/articles/PMC8016480
407,2021 Feb 15,"Villanustre F, Chala A, Dev R, Xu L, LexisNexis JS, Furht B, Khoshgoftaar T",Modeling and tracking Covid-19 cases using Big Data analytics on HPCC system platform,Journal of Big Data,33614394,10.1186/s40537-021-00423-z,PMC7883950,https://www.ncbi.nlm.nih.gov/pmc/articles/PMC7883950
408,2021 Feb 11,"Pavel A, del Giudice G, Federico A, Di Lieto A, Kinaret PA, Serra A, Greco D",Integrated network analysis reveals new genes suggesting COVID-19 chronic effects and treatment,Briefings in Bioinformatics,33569598,10.1093/bib/bbaa417,PMC7929418,https://www.ncbi.nlm.nih.gov/pmc/articles/PMC7929418
409,2021 Feb 11,"McLuskey K, Wandy J, Vincent I, van der Hooft JJ, Rogers S, Burgess K, Daly R",Ranking Metabolite Sets by Their Activity Levels,Metabolites,33670102,10.3390/metabo11020103,PMC7916825,https://www.ncbi.nlm.nih.gov/pmc/articles/PMC7916825
